scraped_id,text,tagger,tagged_date,label,clean_data
1047,Ben her türlü mutlu olurum sen merak etme.,seymasa,2022-08-01 13:39:18.130562,Nötr,ben her türlü mutlu olurum sen merak etme 
1048,seni ben anlarım,seymasa,2022-08-01 13:39:18.135876,Nötr,seni ben anlarım
1049,"Kalbini 'temiz' tut ki, kalbi 'temiz' olanı hak edesin..",seymasa,2022-08-01 13:39:18.135876,Nötr,kalbini temiz tut ki kalbi temiz olanı hak edesin 
1050,Bursa'da çöp ev olduğu gerekçesiyle boşaltılmak istenen evde 1 yıldır kilitli tutulan 9 yaşında bir çocuk bulundu…,seymasa,2022-08-01 13:39:18.141832,Nötr,bursa da çöp ev olduğu gerekçesiyle boşaltılmak istenen evde  yıldır kilitli tutulan  yaşında bir çocuk bulundu 
1051,Aferin Emir #EmirhanDelibaş,seymasa,2022-08-01 13:39:18.141832,Nötr,aferin emir
1052,Bu dünyanın güzellikleri de var görmek gerek...,seymasa,2022-08-01 10:24:00.696069,Nötr,bu dünyanın güzellikleri de var görmek gerek 
1053,Millet lisede aşık oluyo yıllar sonra karşılaşıp o kişiyle evleniyor bizim okuldaki tek erkek ordulu bekçi erdal abiydi,seymasa,2022-08-02 09:58:12.063682,Nötr,millet lisede aşık oluyo yıllar sonra karşılaşıp o kişiyle evleniyor bizim okuldaki tek erkek ordulu bekçi erdal abiydi
1054,"Fransa'da yapılan bir sosyal deney, dünya gündemine oturdu. Fransızlar, gözleri önünde çocuk kaçırılmasına tepkisiz kaldı. Sözkonusu görüntüler, ""Toplumsal dayanışma değerlerinin çöküşü"" olarak yorumlandı.",Erdinç,2022-08-02 09:58:12.078636,Nötr,fransa da yapılan bir sosyal deney dünya gündemine oturdu fransızlar gözleri önünde çocuk kaçırılmasına tepkisiz kaldı sözkonusu görüntüler toplumsal dayanışma değerlerinin çöküşü olarak yorumlandı 
1055,Mahallede yaşıtım yokk???,seymasa,2022-08-02 09:58:12.078636,Nötr,mahallede yaşıtım yokk 
1056,İlkokuldaki sira arkadasimla ortaokula kadar aynı sırada oturduk lisede de okulumuza nakil gelmisti birlikte mezun olduk 12 sene be 12 sene,seymasa,2022-08-02 09:58:12.063555,Nötr,i lkokuldaki sira arkadasimla ortaokula kadar aynı sırada oturduk lisede de okulumuza nakil gelmisti birlikte mezun olduk  sene be  sene
1057,Helal olsun diyorum senelerden beridir Türk aklı böyle çalışıyor bizi zayıf bir ülke konumunda görüyorlar ama o işler öyle olmuyor Yunanlar önce kendi tarihinize bakın kim kime ne yapmış ondan sonra konuşun karşımızda helal olsun cesur yürekli adam #HulusiAkar #savunmabakanlığı,seymasa,2022-08-02 09:58:12.071785,Nötr,helal olsun diyorum senelerden beridir türk aklı böyle çalışıyor bizi zayıf bir ülke konumunda görüyorlar ama o işler öyle olmuyor yunanlar önce kendi tarihinize bakın kim kime ne yapmış ondan sonra konuşun karşımızda helal olsun cesur yürekli adam
1058,yaşıtlarım kpss çalışırken ben,seymasa,2022-08-02 09:58:12.063555,Nötr,yaşıtlarım kpss çalışırken ben
1059,bir çoğunuz la aynı yaştayız ama siz büyüyünce anlayacaksınız.,Erdinç,2022-08-02 09:58:12.063555,Nötr,bir çoğunuz la aynı yaştayız ama siz büyüyünce anlayacaksınız 
1060,"Bir yiğit ardından, 2718. gün.  Bayrak bir ülke için elbet şandır. Türkler için bayrak, dünyada candır. Şehitleri temsil eden destandır. Ay yıldızlı bayrak, hürriyetimiz.  Unutma, unutturma. #FıratYılmazÇakıroğlu",Erdinç,2022-08-02 09:58:12.063555,Nötr,bir yiğit ardından  gün bayrak bir ülke için elbet şandır türkler için bayrak dünyada candır şehitleri temsil eden destandır ay yıldızlı bayrak hürriyetimiz unutma unutturma 
1061,"Ya benim çok kız arkadaşım yok, pek anlaşmıyorum kızlarla, yakın arkadaşlarım falan hep erkek, kardeş gibiyizdir hepsiyle",seymasa,2022-08-02 09:58:12.071785,Nötr,ya benim çok kız arkadaşım yok pek anlaşmıyorum kızlarla yakın arkadaşlarım falan hep erkek kardeş gibiyizdir hepsiyle
1062,Ev arkadaşım ben yokken eve kedi atıyor,seymasa,2022-08-02 09:58:12.063682,Nötr,ev arkadaşım ben yokken eve kedi atıyor
1063,Belçikalı ev arkadaşım dolapta sakladığı çikolataları sadece Yunus Akgün’ün oynadığı maçlarda yiyor. Yunus Akgün öyle bir topçu işte.,Erdinç,2022-08-02 09:58:12.063555,Nötr,belçikalı ev arkadaşım dolapta sakladığı çikolataları sadece yunus akgün ün oynadığı maçlarda yiyor yunus akgün öyle bir topçu işte 
1064,Başkalarını incitmeden yaşamayı öğren. #HzAli,Erdinç,2022-08-02 09:58:12.078636,Nötr,başkalarını incitmeden yaşamayı öğren 
1065,Biz büyük bir Aileyiz  Rabbım birliğimizi daim eylesin Teşekkürler çalışma arkadaşlarım Anamas Tohum Merkez Anadolu Kimya,Erdinç,2022-08-02 09:58:12.078636,Nötr,biz büyük bir aileyiz rabbım birliğimizi daim eylesin teşekkürler çalışma arkadaşlarım anamas tohum merkez anadolu kimya
1066,bizim dershanede tyt mat hocasi test verip kosede yks cografya tarih calisiyodu,Erdinç,2022-08-02 09:58:12.071785,Nötr,bizim dershanede tyt mat hocasi test verip kosede yks cografya tarih calisiyodu
1067,1918 Mondoros mütarekesi ile 1922 mudanya mütarekesi arasında ingilizler yasaklamış,Erdinç,2022-08-02 09:58:12.063555,Nötr, mondoros mütarekesi ile  mudanya mütarekesi arasında ingilizler yasaklamış
1068,Sorularınıza Toplu cevap;  #uma   #ape  #doge ve #raca   #GALA  #hbar  Sorularınızın cevaplarını telegram kanalımda paylaşım Dostlar   Yatırım tavsiyesi değildir.. takipçilerimin sorularına cevaptır. Saygılarımla Telegram kanalım  https://t.me/genelpatron,Erdinç,2022-08-02 09:58:12.078636,Nötr,sorularınıza toplu cevap ve sorularınızın cevaplarını telegram kanalımda paylaşım dostlar yatırım tavsiyesi değildir takipçilerimin sorularına cevaptır saygılarımla telegram kanalım 
1069,Erkek arkadaşım isterse gri eşofman altı giyebilir,seymasa,2022-08-02 09:58:12.063555,Nötr,erkek arkadaşım isterse gri eşofman altı giyebilir
1070,Sırtınızı sadece güneşe verin.  İnsanlar sırt verilecek kadar güvenilir değil.,Erdinç,2022-08-02 09:58:12.063555,Nötr,sırtınızı sadece güneşe verin i nsanlar sırt verilecek kadar güvenilir değil 
1071,"Fransızlar: “Türk istihbaratının yenilmez reformcusu Hakan Fidan""  Milli İstihbarat Teşkilatı",Erdinç,2022-08-02 09:58:12.071785,Nötr,fransızlar türk istihbaratının yenilmez reformcusu hakan fidan milli i stihbarat teşkilatı
1072,Neden tüm arkadaşlarım evleniyor ben kimle gezip tozucam,seymasa,2022-08-02 09:58:12.063682,Nötr,neden tüm arkadaşlarım evleniyor ben kimle gezip tozucam
1073,kiz arkadasim ve londra sokaklari,Erdinç,2022-08-02 09:58:12.071785,Nötr,kiz arkadasim ve londra sokaklari
1074,Aldığım şeye bakın çok sevimli değil mi,Erdinç,2022-08-02 09:58:12.063682,Nötr,aldığım şeye bakın çok sevimli değil mi
1075,"Ev arkadaşım Mart ayından beri Amsterdama, Prag'a ve iki kez de Barcelonaya gitti. Şimdi de Meksikaya vize almış birkaç haftaya gidiyor.  Benle adalara gelecek var mı?",Erdinç,2022-08-02 09:58:12.071785,Nötr,ev arkadaşım mart ayından beri amsterdama prag a ve iki kez de barcelonaya gitti şimdi de meksikaya vize almış birkaç haftaya gidiyor benle adalara gelecek var mı 
1076,"Bugün marketteki yanımdaki yaşıtım evi için bir ton alışveriş yapıp bebek bezi aldı ben isrnyanında karpuzlu ıce tea ve tadelle aldım hatta bekleyemedim onu beklerken yedim içtim , be bu insanlar ne yapar bu yaşta bu nasıl sistemdir bu adam ev geçindirir, bu adam neleri düşünür",Erdinç,2022-08-02 09:58:12.071785,Nötr,bugün marketteki yanımdaki yaşıtım evi için bir ton alışveriş yapıp bebek bezi aldı ben isrnyanında karpuzlu ıce tea ve tadelle aldım hatta bekleyemedim onu beklerken yedim içtim be bu insanlar ne yapar bu yaşta bu nasıl sistemdir bu adam ev geçindirir bu adam neleri düşünür
1077,yaşıtlarım yanımda cıvıl cıvıl takılırken 50 yaş gibiyim yazık bana,Erdinç,2022-08-02 09:58:12.063555,Nötr,yaşıtlarım yanımda cıvıl cıvıl takılırken  yaş gibiyim yazık bana
1078,#mebsınaviptal  biz uzmanız. Ve en güvenilir kurumuz.,Erdinç,2022-08-02 09:58:12.063682,Nötr,biz uzmanız ve en güvenilir kurumuz 
1079,Sınıfta hep çok konuşanı sevdiler Bizim gibiler arka sırada oturup sessizce  Arkadaşların ne yaptığını izleyeni degil,Erdinç,2022-08-02 09:58:12.063555,Nötr,sınıfta hep çok konuşanı sevdiler bizim gibiler arka sırada oturup sessizce arkadaşların ne yaptığını izleyeni degil
1080,Okuldaki erkek öğrencilerle anlaşma http://yaptık.Saçlarımı sıfıra vurursam onlar da vuracaktı.Sözümü tuttum sıra onlarda.Okul kışlaya dönecek.,Erdinç,2022-08-02 09:58:12.063682,Nötr,okuldaki erkek öğrencilerle anlaşma sıfıra vurursam onlar da vuracaktı sözümü tuttum sıra onlarda okul kışlaya dönecek 
1081,"#DiziÖnerisi - Parfum  #Netflix’in Almanya yapımı 6 bölümden oluşan mini dizisi Patrick Suskind‘in 1985 yılı basımı Das Parfum isimli romanından uyarlama. Dizinin konusu: İnsanüstü bir koku alma duyusuna sahip olan bir parfümcü, bir yatılı okuldaki kız öğrencileri  +",Erdinç,2022-08-02 09:58:12.078636,Nötr, parfum almanya yapımı  bölümden oluşan mini dizisi patrick suskind in  yılı basımı das parfum isimli romanından uyarlama dizinin konusu i nsanüstü bir koku alma duyusuna sahip olan bir parfümcü bir yatılı okuldaki kız öğrencileri 
1082,9 günlük tatilin sonuna gelmiş bulunmaktayım günaydın emekçi arkadaşlarım,Erdinç,2022-08-02 09:58:12.063682,Nötr, günlük tatilin sonuna gelmiş bulunmaktayım günaydın emekçi arkadaşlarım
1083,Üşenmeyip saklama kabına küp şekerleri tek tek dizmişim kız arkadaşım da gelmiş evlenince de ev işlerinde bana yardım edecek misin diyor. İllallah edip nolur sen karışma diye yalvarmazsan bende bir şey bilmiyorum,Erdinç,2022-08-02 09:58:12.063682,Nötr,üşenmeyip saklama kabına küp şekerleri tek tek dizmişim kız arkadaşım da gelmiş evlenince de ev işlerinde bana yardım edecek misin diyor i llallah edip nolur sen karışma diye yalvarmazsan bende bir şey bilmiyorum
1084,"Hem yurttan hem sınıftan yakın bir arkadaşımın ablası okuduğumuz şehre atandı,ev tuttular beraber.Arkadaşım yurttan ayrılcam beni dışlayacaksınız diye üzülüyo biz de artık bi evimiz var diye kendi kendimize gelin güvey oluyoruz  Bir yandan da üzülüyorum arkadaşım gidiyo diye",Erdinç,2022-08-02 09:58:12.063682,Nötr,hem yurttan hem sınıftan yakın bir arkadaşımın ablası okuduğumuz şehre atandı ev tuttular beraber arkadaşım yurttan ayrılcam beni dışlayacaksınız diye üzülüyo biz de artık bi evimiz var diye kendi kendimize gelin güvey oluyoruz bir yandan da üzülüyorum arkadaşım gidiyo diye
1085,Arkadaşım ev tuttu evimiz diye fotolarını atmış bana :'),Erdinç,2022-08-02 09:58:12.078636,Nötr,arkadaşım ev tuttu evimiz diye fotolarını atmış bana 
1086,Hangisi daha sevimli ?,Erdinç,2022-08-02 09:58:12.078636,Nötr,hangisi daha sevimli 
1087,gördüğünüz bütün dişil enerjileri unutunortamı domine etmesiyle kraliçe bir anda tahta oturdu,Erdinç,2022-08-02 09:58:12.078636,Nötr,gördüğünüz bütün dişil enerjileri unutunortamı domine etmesiyle kraliçe bir anda tahta oturdu
1088,Gittiğim psikolog yarın bizim dershanede sınav kaygısıyla ilgili seminer verecekmiş kadını görünce kendimi tutamayıp ağlıycam kesin o kadar insanın içinde ya off,Erdinç,2022-08-02 09:58:12.071785,Nötr,gittiğim psikolog yarın bizim dershanede sınav kaygısıyla ilgili seminer verecekmiş kadını görünce kendimi tutamayıp ağlıycam kesin o kadar insanın içinde ya off
1089,27 Temmuz 1922 Perşembe. Yunan ordusu İstanbul'a taaruzu başlatmak üzere.. Yunanistan bir süredir Dedeağaç üzerinden Trakya'ya olan sevkiyatı gizlemiyordu. İlerleyen günlerde Yunanistan ile Fransa-İngiltere savaş noktasına gelecekti. twitter.com/hakikatitarih/…,Erdinç,2022-08-02 09:58:12.078636,Nötr, temmuz  perşembe yunan ordusu i stanbul a taaruzu başlatmak üzere yunanistan bir süredir dedeağaç üzerinden trakya ya olan sevkiyatı gizlemiyordu i lerleyen günlerde yunanistan ile fransa i ngiltere savaş noktasına gelecekti twitter com hakikatitarih 
1090,Günaydın Atatürkçü Can Dostlarım,seymasa,2022-08-02 09:58:12.071785,Nötr,günaydın atatürkçü can dostlarım
1091,"Bizim de 100 kişilik sınıfta 5,6 kişi falan geçmişti ilk yılki dersten.",Erdinç,2022-08-02 09:58:12.071785,Nötr,bizim de  kişilik sınıfta   kişi falan geçmişti ilk yılki dersten 
1092,",,,""  Allah katında en sevimli ses, tevbekar bir günahkârın ; "" ya rabbi"" diyen sesidir ...""      ,,, İmam'ı Gazâli ,,,",Erdinç,2022-08-02 09:58:12.063682,Nötr, allah katında en sevimli ses tevbekar bir günahkârın ya rabbi diyen sesidir i mam ı gazâli 
1093,Günaydın arkadaşlarım. Çarşamba akşamı sevgili Hasan Bulut'un sunduğu Karalama Defteri Proğramında bir araya geliyoruz ..Haber edeyim dedim..Serin günler dileyeyim. #hasanbulut #haluktolgailhan,Erdinç,2022-08-02 09:58:12.063555,Nötr,günaydın arkadaşlarım çarşamba akşamı sevgili hasan bulut un sunduğu karalama defteri proğramında bir araya geliyoruz haber edeyim dedim serin günler dileyeyim 
1094,Okuldaki kız hallettim dedi bende tamam dedim ama acaba neyi halletti ve bana söyledi hiçbir fikrim yok,Erdinç,2022-08-02 09:58:12.063682,Nötr,okuldaki kız hallettim dedi bende tamam dedim ama acaba neyi halletti ve bana söyledi hiçbir fikrim yok
1095,Moralim bozuktu odama çekildim. Ev arkadaşım geldi. Konuşmak istemiyorum dedim. Ne konuşması git iki ekmek al da kahvaltı yapalım dedi. Hayat çok garip,Erdinç,2022-08-02 09:58:12.063682,Nötr,moralim bozuktu odama çekildim ev arkadaşım geldi konuşmak istemiyorum dedim ne konuşması git iki ekmek al da kahvaltı yapalım dedi hayat çok garip
1096,"Peşindeyim, 4 ay sonra aynı yaştayız. Kutlu olsun",Erdinç,2022-08-02 09:58:12.071785,Nötr,peşindeyim  ay sonra aynı yaştayız kutlu olsun
1097,Ev arkadaşım nohut haşlayıp buzluğa koyuyor. Biz level atladık,Erdinç,2022-08-02 09:58:12.063682,Nötr,ev arkadaşım nohut haşlayıp buzluğa koyuyor biz level atladık
1098,"#dot  bence yoruma gerek yok dostlarım, destekten aldık, şuan güzel bir kârda",Erdinç,2022-08-02 09:58:12.063555,Nötr,bence yoruma gerek yok dostlarım destekten aldık şuan güzel bir kârda
1099,Rahmetli abim ve ben aynı sene liseden mezun olduk. Rahmetli babam ikinizi birden dershaneye gönderemem biriniz gider diğeri onunla çalışır dedi. İkimiz de dershane istemiyoruz. Ben nasıl olsa kazanırım abim gitsin dedim abim Mehmet gitsin iyi bir yer kazansın dedi.,Erdinç,2022-08-02 09:58:12.063682,Nötr,rahmetli abim ve ben aynı sene liseden mezun olduk rahmetli babam ikinizi birden dershaneye gönderemem biriniz gider diğeri onunla çalışır dedi i kimiz de dershane istemiyoruz ben nasıl olsa kazanırım abim gitsin dedim abim mehmet gitsin iyi bir yer kazansın dedi 
1100,"Prf Dr Mehmet Tümay ı yakinen tanırım. aynı dersleri aynı hocalardan aldık.aynı okuldan aynı sene mezun olduk. Kendisi çok çalışkan, prensip sahibi ve bu makamı hakeden birisidir.",Erdinç,2022-08-02 09:58:12.063682,Nötr,prf dr mehmet tümay ı yakinen tanırım aynı dersleri aynı hocalardan aldık aynı okuldan aynı sene mezun olduk kendisi çok çalışkan prensip sahibi ve bu makamı hakeden birisidir 
1101,Yeni ev arkadaşım bulut,Erdinç,2022-08-02 09:58:12.063555,Nötr,yeni ev arkadaşım bulut
1102,"""Dupduru bakan ve dürüst konuşan her şeyi seviyorum.""  Nietzsche",Erdinç,2022-08-02 09:58:12.078636,Nötr, dupduru bakan ve dürüst konuşan her şeyi seviyorum nietzsche
1103,"Suriyeliler yaşıyor valla,burdakilerin yerinde olsam ülkeme dõnerim Esat halkını yaşatıyor Bīzimkiler",seymasa,2022-08-02 09:58:12.063555,Nötr,suriyeliler yaşıyor valla burdakilerin yerinde olsam ülkeme dõnerim esat halkını yaşatıyor bīzimkiler
1104,"bugün yurdun eylül ve ekim ayları için olan ödemesinin son günüymüş, oda arkadaşım sen kesin unutmuşsundur deyip haber verince son anda yatırdım ve bütün param bitti şu an çok mutsuzum",seymasa,2022-08-02 09:58:12.063555,Nötr,bugün yurdun eylül ve ekim ayları için olan ödemesinin son günüymüş oda arkadaşım sen kesin unutmuşsundur deyip haber verince son anda yatırdım ve bütün param bitti şu an çok mutsuzum
1105,"Değerli dostlarım Ömrünüz su gibi aziz, yaşamınız berrak ve zelal olsun, insanların bir birinin açığını aradığı ve tekrar tuğlalı günler...çekin şu tuğlayıda kim dibinde kalıyorsa kalsın. Onurumuza sahip çıkalım, yalanlara teslim olmayalım.   Sağlıklı huzurlu mutlu yarınlara...",Erdinç,2022-08-02 09:58:12.063555,Nötr,değerli dostlarım ömrünüz su gibi aziz yaşamınız berrak ve zelal olsun insanların bir birinin açığını aradığı ve tekrar tuğlalı günler çekin şu tuğlayıda kim dibinde kalıyorsa kalsın onurumuza sahip çıkalım yalanlara teslim olmayalım sağlıklı huzurlu mutlu yarınlara 
1106,Başta kız arkadaşım olmak üzere sınava girecek bütün meslektaşlarıma sınavda başarılar dilerim. Hak edenin emeğinin karşılığını aldığı bir sınav olsun. #kpss2022,Erdinç,2022-08-02 09:58:12.063555,Nötr,başta kız arkadaşım olmak üzere sınava girecek bütün meslektaşlarıma sınavda başarılar dilerim hak edenin emeğinin karşılığını aldığı bir sınav olsun 
1107,"Selam olsun sevgili dostlarım; gün doğdu,yine bir umutla,aşkla,huzurlu bir gün geçirmeniz dileğiyle...  #Andresovid #muzik",Erdinç,2022-08-02 09:58:12.078636,Nötr,selam olsun sevgili dostlarım gün doğdu yine bir umutla aşkla huzurlu bir gün geçirmeniz dileğiyle 
1108,Kıymetli arkadaşlarım etkinlik tanıtım afişimizi tüm sosyal medya hesaplarında ve gruplarda paylaşarak öğretmen arkadaşlarımızın etkinliğe katılmalarını sağlayalım. Göstereceğiniz ilgiye şimdiden teşekkür ederim Gurubumuz linki https://t.me/UzmanOgretmenlikSinavlaOlmaz…,Erdinç,2022-08-02 09:58:12.063682,Nötr,kıymetli arkadaşlarım etkinlik tanıtım afişimizi tüm sosyal medya hesaplarında ve gruplarda paylaşarak öğretmen arkadaşlarımızın etkinliğe katılmalarını sağlayalım göstereceğiniz ilgiye şimdiden teşekkür ederim gurubumuz linki 
1109,"Bugün #ÇukurovaÜniversitesi İktisadi ve İdari Bilimler Fakültesinde Öğretim Üyesi olan Üniversiteyi birlikte okuduğumuz kıymetli kardeşim, arkadaşım, dostum  olan Prof. Dr. Harun Bal'ı ziyaret ettik. Nazik ev sahipliği için çok teşekkür eder,  görevinde üstün başarılar dileriz.",Erdinç,2022-08-02 09:58:12.063555,Nötr,bugün i ktisadi ve i dari bilimler fakültesinde öğretim üyesi olan üniversiteyi birlikte okuduğumuz kıymetli kardeşim arkadaşım dostum olan prof dr harun bal ı ziyaret ettik nazik ev sahipliği için çok teşekkür eder görevinde üstün başarılar dileriz 
1110,Dünya Düzce Günleri etkinliklerimizde sevimli dostlarımızı unutmuyoruz.    #DünyaDüzceGünleri etiketi ile yapacağınız her paylaşım için sokak hayvanlarına 1 kilogram mama bağışlayacağız.,Erdinç,2022-08-02 09:58:12.063682,Nötr,dünya düzce günleri etkinliklerimizde sevimli dostlarımızı unutmuyoruz etiketi ile yapacağınız her paylaşım için sokak hayvanlarına  kilogram mama bağışlayacağız 
1111,"Yaşıtlarım ev araba alıyor , ben alttan ders alıyorum",seymasa,2022-08-02 09:58:12.078636,Nötr,yaşıtlarım ev araba alıyor ben alttan ders alıyorum
1112,Aynı yaştayız ama Mustang hala çok genç!,seymasa,2022-08-02 09:58:12.078636,Nötr,aynı yaştayız ama mustang hala çok genç 
1113,"""Allah bize yollarımızı dosdoğru göstermişken, biz ne diye ona tevekkül etmeyelim? Bize yaptığınız eziyete elbette katlanacağız. Tevekkül edenler yalnız Allah'a tevekkül etsinler.""  (İbrahim Suresi, 12)  Akbank Suriyeliler TOKİ Çevik Bir Fatma",Erdinç,2022-08-02 09:58:12.078636,Nötr, allah bize yollarımızı dosdoğru göstermişken biz ne diye ona tevekkül etmeyelim bize yaptığınız eziyete elbette katlanacağız tevekkül edenler yalnız allah a tevekkül etsinler i brahim suresi  akbank suriyeliler toki çevik bir fatma
1114,Amerikalı ev arkadaşım bana bir ton şey anlattı ama ben yalnızca yes dedim. Şu an lunaparka gidiyoruz. Meğer bana lunaparka gidelim mi demiş olacak ki ben de evet demişim. Demek ki neymiş öyle her şeye yes mes demek yokmuş.,seymasa,2022-08-02 09:58:12.063682,Nötr,amerikalı ev arkadaşım bana bir ton şey anlattı ama ben yalnızca yes dedim şu an lunaparka gidiyoruz meğer bana lunaparka gidelim mi demiş olacak ki ben de evet demişim demek ki neymiş öyle her şeye yes mes demek yokmuş 
1115,Kızımla beraber keyifli bir pazar geçiriyoruz  Herkese iyi pazarlar diliyorum can dostlarım,Erdinç,2022-08-02 09:58:12.071785,Nötr,kızımla beraber keyifli bir pazar geçiriyoruz herkese iyi pazarlar diliyorum can dostlarım
1116,Erkek voleybol maçlarında yer silici olarak nereye başvuruluyor söyleyebilir misiniz bir arkadaşım soruyor,seymasa,2022-08-02 09:58:12.071785,Nötr,erkek voleybol maçlarında yer silici olarak nereye başvuruluyor söyleyebilir misiniz bir arkadaşım soruyor
1117,arkadasim bana kahvalti hazirlamis bu kiz benim kaderim,Erdinç,2022-08-02 09:58:12.071785,Nötr,arkadasim bana kahvalti hazirlamis bu kiz benim kaderim
1118,"Milli İstihbarat Teşkilatı Başkanı Hakan Fidan:  ""Oyun değiştiren stratejiler üretme, istihbarat alanında yeni metotlar geliştirme, kendi tekniğini dünyadaki değişimler ışığında yenileriyle harmanlama, değişime en hızlışekilde uyum sağlama gayreti içerisindeyiz""  -2020-",Erdinç,2022-08-02 09:58:12.063682,Nötr,milli i stihbarat teşkilatı başkanı hakan fidan oyun değiştiren stratejiler üretme istihbarat alanında yeni metotlar geliştirme kendi tekniğini dünyadaki değişimler ışığında yenileriyle harmanlama değişime en hızlışekilde uyum sağlama gayreti içerisindeyiz  
1119,Valla Dayı çizdirdim rahatladım. okuyan akranlarım varsa çile çekmeyin 2 yıllık lens parası amorti ediyor.,Erdinç,2022-08-02 09:58:12.071785,Nötr,valla dayı çizdirdim rahatladım okuyan akranlarım varsa çile çekmeyin  yıllık lens parası amorti ediyor 
1120,"Merhaba can dostlarım  Evliya Çelebi ""Aydın Dağlarından yağ Ovalarından bal akan diyardır"" #Salı  #Günaydın",Erdinç,2022-08-02 09:58:12.071785,Nötr,merhaba can dostlarım evliya çelebi aydın dağlarından yağ ovalarından bal akan diyardır 
1121,Bizim dershanede hoca bi küçük üçgen bı büyük üçgen çizmişti büyüğün iç açıları toplamı 180 diğerinin kaçtır demişti herkes 90 dedi ben ölçtüm 120 falan dedim,Erdinç,2022-08-02 09:58:12.071785,Nötr,bizim dershanede hoca bi küçük üçgen bı büyük üçgen çizmişti büyüğün iç açıları toplamı  diğerinin kaçtır demişti herkes  dedi ben ölçtüm  falan dedim
1122,𝐌𝐚𝐥𝐜𝐨𝐥𝐦 |  𝗔𝗰̧ı𝗹ı𝘀̧   Günaydın….Dostlarım  Güzel bir günden hepinize selam olsun.  Günümüz şimdiden bereketli olsun   Hazırsanız başlayalım,Erdinç,2022-08-02 09:58:12.071785,Nötr,𝐌𝐚𝐥𝐜𝐨𝐥𝐦 𝗔𝗰 ı𝗹ı𝘀 günaydın dostlarım güzel bir günden hepinize selam olsun günümüz şimdiden bereketli olsun hazırsanız başlayalım
1123,Bence dürüst olalım yoksa bende dürüst olmayacağım dkjskdjdkd #İbrahimSelimİleBuGece,seymasa,2022-08-02 09:58:12.071785,Nötr,bence dürüst olalım yoksa bende dürüst olmayacağım dkjskdjdkd
1124,"Bizim bir komşumuzun kızı da benimle yaşıttı, lise 1 de sınıfta kaldı diye bir daha okula göndermediler ve 17 yaşında evlendirdiler kızı",elif,2022-08-02 09:58:12.063555,Nötr,bizim bir komşumuzun kızı da benimle yaşıttı lise  de sınıfta kaldı diye bir daha okula göndermediler ve  yaşında evlendirdiler kızı
1125,Bizim yedekler sınıfta kaldı,seymasa,2022-08-02 09:58:12.071785,Nötr,bizim yedekler sınıfta kaldı
1126,Yunan spiker Ioannis Theodoratos yine döktürmüş. Yunanlar için en büyük bozgun 1071 Malazgirt yenilgisi 1453 İstanbul'un fethi 1941 Alman Nazi işgali değilmiş. EN BÜYÜK BOZGUN 1922'de Türkler tarafından Anadolu'dan kovulup denize dökülmeleriymiş!,elif,2022-08-02 09:58:12.071785,Nötr,yunan spiker ioannis theodoratos yine döktürmüş yunanlar için en büyük bozgun  malazgirt yenilgisi  i stanbul un fethi  alman nazi işgali değilmiş en büyük bozgun  de türkler tarafından anadolu dan kovulup denize dökülmeleriymiş 
1127,~ DEDİKODU  ~  Bizim dershanede bir kız var benim okuldan en yakın arkadaşım sandığım kişi ama şere.. Neyse ondan işte bugün dershaneye gittim suratıma bile bakmadı benim yerime oturmuş ve yanına da arkasından bir ton attığı kız oturmuş Tamam mı? Baya bunlar kanki olmuş+++,elif,2022-08-02 09:58:12.063555,Nötr, dedi kodu bizim dershanede bir kız var benim okuldan en yakın arkadaşım sandığım kişi ama şere neyse ondan işte bugün dershaneye gittim suratıma bile bakmadı benim yerime oturmuş ve yanına da arkasından bir ton attığı kız oturmuş tamam mı baya bunlar kanki olmuş 
1128,Bazi insanlarla ayni yastayiz ama ayni yasta degiliz,elif,2022-08-02 09:58:12.063555,Nötr,bazi insanlarla ayni yastayiz ama ayni yasta degiliz
1129,Bizim sınıfta da var böyle bi dolandırıcı ckdjxj ama yabancıları dolandırıyo onlar mahkemeye vermiyomuş ckdjxhsh,elif,2022-08-02 09:58:12.063682,Nötr,bizim sınıfta da var böyle bi dolandırıcı ckdjxj ama yabancıları dolandırıyo onlar mahkemeye vermiyomuş ckdjxhsh
