scraped_id,text,tagger,tagged_date,label,clean_data
795,çok mutluyuz kraliçe ekrana döndü   ZeytinAğacı 28TemmuzNetflixte  #TubaBüyüküstün #MuratBoz,Meral,2022-08-04 12:06:01.868804,Nötr,çok mutluyuz kraliçe ekrana döndü zeytinağacı temmuznetflixte
796,"Şu anda denizde olanlara, Evde olup da fav yapanlara kucak dolusu sevgiler, #pazar #denizkeyfi",seymasa,2022-08-04 12:07:29.137951,Nötr,şu anda denizde olanlara evde olup da fav yapanlara kucak dolusu sevgiler 
797,Duy beni ekibi o kadar iyi pr çalışması yapıyor ki helal olsun cidden sürekli aktifler falan çok iyi #duybeni,seymasa,2022-08-04 12:06:01.868804,Nötr,duy beni ekibi o kadar iyi pr çalışması yapıyor ki helal olsun cidden sürekli aktifler falan çok iyi
798,"Şüphe, Kant’ın ifadesiyle söylersek: “aklı, dogmatik tatlı uykusundan uyandırmak ve kendi konumunu titiz bir şekilde sınava tabi tutmaktır…” . Demek ki şüphe, insanın ilk önce kendi bilgi ve inançlarıyla hesaplaşmasıdır.  (Şüphenin Tarihi)",Elif,2022-08-04 16:55:23.679170,Nötr,şüphe kant ın ifadesiyle söylersek aklı dogmatik tatlı uykusundan uyandırmak ve kendi konumunu titiz bir şekilde sınava tabi tutmaktır demek ki şüphe insanın ilk önce kendi bilgi ve inançlarıyla hesaplaşmasıdır şüphenin tarihi 
799,"Ana rahmine sıgıyorsun,dogduktan sonra buyuk saraylar,köşklere sıgmıyorsun oysa en fazla 2 m gireceksin. 8 evlat bir anneyi evine sıgdıramadı. Gariplere yer yokmuşçivisi çıkmış her yer çürük",Elif,2022-08-04 16:55:23.678371,Nötr,ana rahmine sıgıyorsun dogduktan sonra buyuk saraylar köşklere sıgmıyorsun oysa en fazla  m gireceksin  evlat bir anneyi evine sıgdıramadı gariplere yer yokmuşçivisi çıkmış her yer çürük
800,Deniz Harika,seymasa,2022-08-04 12:06:04.894124,Nötr,deniz harika
801,"İnsanda güzel olan yüzdür ,Yüzde güzel olan gözdür ,Ama insanı insan yapan ,Ağızdan çıkan sözdür …mutlu akşamlar olsun ,Can arkadaşlarım ,saygılar ,sevgiler",Elif,2022-08-04 16:55:23.679170,Nötr,i nsanda güzel olan yüzdür yüzde güzel olan gözdür ama insanı insan yapan ağızdan çıkan sözdür mutlu akşamlar olsun can arkadaşlarım saygılar sevgiler
802,Kadına şiddet bitmiyor.,seymasa,2022-08-04 12:06:22.971227,Nötr,kadına şiddet bitmiyor 
803,Yaşımla yaşadıklarım hiç adaletli değil ..,seymasa,2022-08-04 12:07:29.137951,Nötr,yaşımla yaşadıklarım hiç adaletli değil 
804,çıkamıyorum videodan,seymasa,2022-08-04 12:06:04.894124,Nötr,çıkamıyorum videodan
805,Doğu ve güneydoğu kültür sanat derneği yöneticisi arkadaşlarımızı ilçemizde ağırlayarak hoş bir sohbette bulunduk.,Elif,2022-08-04 16:55:23.680441,Nötr,doğu ve güneydoğu kültür sanat derneği yöneticisi arkadaşlarımızı ilçemizde ağırlayarak hoş bir sohbette bulunduk 
806,Yapanın ellerine sağlık çok minnoş olmuş,seymasa,2022-08-04 12:06:04.894124,Nötr,yapanın ellerine sağlık çok minnoş olmuş
807,"Uzungöl, Trabzon  Güzel ve temiz manzarası..  #YiyipBitirdinizÜlkeyi  Nerden nereye..  .",seymasa,2022-08-04 12:06:01.868804,Nötr,uzungöl trabzon güzel ve temiz manzarası nerden nereye 
808,"Burada bir kardeşimiz benzer şeyler yazdı Ben de destek mahiyetinde yazdım Daha da yazdı... Sonra aslında bana yazdığını anladım. Özür dileyip uzak durdum. Daha sonra o özür beyan edip başka nedenlerle gergin olduğunu, beni saygı değer bulduğunu yazdı Şimdi takip ve ...DEVAMI VAR",Elif,2022-08-04 16:55:23.679170,Nötr,burada bir kardeşimiz benzer şeyler yazdı ben de destek mahiyetinde yazdım daha da yazdı sonra aslında bana yazdığını anladım özür dileyip uzak durdum daha sonra o özür beyan edip başka nedenlerle gergin olduğunu beni saygı değer bulduğunu yazdı şimdi takip ve devami var
809,Her nerede yaşanıyor ve yaşatılıyorsa insanca hakça ve özgürce sevin sevilin kırmayın kırılmayın insanca yaşayın SLM herkese teşekkür ediyorum saygılar sevgiler,Elif,2022-08-04 16:55:23.679170,Nötr,her nerede yaşanıyor ve yaşatılıyorsa insanca hakça ve özgürce sevin sevilin kırmayın kırılmayın insanca yaşayın slm herkese teşekkür ediyorum saygılar sevgiler
810,Harika  #İbrahimÇelikkol  @ibrahimcelikkol   Ellerine sağlık  @ibrahine_italia,seymasa,2022-08-04 12:06:04.894124,Nötr,harika ellerine sağlık
811,Şimdi diceksiniz ki hay allah doğru adamı o mu seçti çünkü haklısınız seçemiyorum,Elif,2022-08-04 16:55:23.679170,Nötr,şimdi diceksiniz ki hay allah doğru adamı o mu seçti çünkü haklısınız seçemiyorum
812,Sizi anlatırken dayanamayıp Reisi içten içe taktir ediyorsunuz çünkü millet bu konuşmanın her Zerresini ezber etti. Liderlik farkınıda biz diyelim bari. #Reisle2023e #TeşekkürlerErdoğan,Meral,2022-08-04 17:56:59.292614,Nötr,sizi anlatırken dayanamayıp reisi içten içe taktir ediyorsunuz çünkü millet bu konuşmanın her zerresini ezber etti liderlik farkınıda biz diyelim bari 
813,"Ne ihraç olduğumda, ne aile fertlerim tutuklandığında, ne de yurt dışına çıkmak zorunda olduğumuzda bir “geçmiş olsun” sözünü esirgeyen akraba, başkasıyla olan görüntülü görüşme esnasında kafasını uzatıp “ah ne kadar özlemiştim seni” diye günah çıkartıyor. Geçti o iş, geçti.",Meral,2022-08-04 17:56:59.290870,Nötr,ne ihraç olduğumda ne aile fertlerim tutuklandığında ne de yurt dışına çıkmak zorunda olduğumuzda bir geçmiş olsun sözünü esirgeyen akraba başkasıyla olan görüntülü görüşme esnasında kafasını uzatıp ah ne kadar özlemiştim seni diye günah çıkartıyor geçti o iş geçti 
814,"Toprağımız için, emeğimiz için, yaşam için... #FatsaMitingi",seymasa,2022-08-04 12:06:01.868804,Nötr,toprağımız için emeğimiz için yaşam için 
815,"Cambaz'ı evlendirdik, gelinimiz pek güzel. Düğün hediyesi olarak yeni ev aldık. Dayadık döşedik. Mükemmel bir kayınpeder oldum mikemmeğl. Mutlu mesut yaşasınlar gayrı...",Elif,2022-08-04 17:56:59.293547,Nötr,cambaz ı evlendirdik gelinimiz pek güzel düğün hediyesi olarak yeni ev aldık dayadık döşedik mükemmel bir kayınpeder oldum mikemmeğl mutlu mesut yaşasınlar gayrı 
816,"“Herkesin evine rahatça ekmek alabildiği, her evde huzurun, bereketin olduğu, hiçbir çocuğun yatağa aç girmediği bir iklimi Millet İttifakı olarak yaratacağız. Ahdimizdir, yapacağız."" Genel Başkanımız, İBB'nin düzenlediği Ahmet İsvan Halk Ekmek Fabrikası Açılışı'nda konuştu.",Meral,2022-08-04 17:56:59.292614,Nötr, herkesin evine rahatça ekmek alabildiği her evde huzurun bereketin olduğu hiçbir çocuğun yatağa aç girmediği bir iklimi millet i ttifakı olarak yaratacağız ahdimizdir yapacağız genel başkanımız i bb nin düzenlediği ahmet i svan halk ekmek fabrikası açılışı nda konuştu 
817,Sanat,seymasa,2022-08-04 12:06:01.868804,Nötr,sanat
818,Birbirini görmeyen ama birbirine sevdalı yüzlerce asker... Böyle komutana böyle asker yakışır #ÇÖH  #SAHOL  #BTC #deprem,seymasa,2022-08-04 16:55:23.679932,Nötr,birbirini görmeyen ama birbirine sevdalı yüzlerce asker böyle komutana böyle asker yakışır
819,Edirne Cezaevi’nde tutuklu bulunan Adnan Oktar'ın cezaevindeki son hali paylaşıldı.,seymasa,2022-08-04 16:55:23.678371,Nötr,edirne cezaevi nde tutuklu bulunan adnan oktar ın cezaevindeki son hali paylaşıldı 
820,"En hayırlı düğün masrafı en az olan düğündür.   Düğünlerle kurduğumuz yuvalarımızı gereksiz teamüller, yokuşa süren koşullar ve nefret ettiren dayatmalarla bereketsizleştirmeyelim.  Huzur olmadıktan sonra hiçbir dünyalığın bir anlamı yoktur. Bereket ve huzur sadeliktedir.",Elif,2022-08-04 17:56:59.290870,Nötr,en hayırlı düğün masrafı en az olan düğündür düğünlerle kurduğumuz yuvalarımızı gereksiz teamüller yokuşa süren koşullar ve nefret ettiren dayatmalarla bereketsizleştirmeyelim huzur olmadıktan sonra hiçbir dünyalığın bir anlamı yoktur bereket ve huzur sadeliktedir 
821,Bazen düşününce iyiki de sahip olduğum aile benim ailemdir diyorum yoksa başka yerde başka insanlarla yaşayamaz mışım diyen başka ademoğlu var mı?,Elif,2022-08-04 17:56:59.293547,Nötr,bazen düşününce iyiki de sahip olduğum aile benim ailemdir diyorum yoksa başka yerde başka insanlarla yaşayamaz mışım diyen başka ademoğlu var mı 
822,Dilek Çemberi                                                                             Seni çok özledim                 mesajı,seymasa,2022-08-04 12:06:22.971227,Nötr,dilek çemberi seni çok özledim mesajı
823,Osmanlı’dan yaşatılan ümmetçi zihniyetin devamıdır bu .! Asla kabullenmez kadına şiddet ve çocuk istismarları. Çocuk yaşta evliliğe evet deyip yasa geçiren zebanilerin boş hevesleridir #İstanbulSözleşmes’ini kaldırmak..! Bizler çok daha güçlü geliyoruz.#Teşekkürler  @kilicdarogluk,Elif,2022-08-04 17:56:59.301011,Nötr,osmanlı dan yaşatılan ümmetçi zihniyetin devamıdır bu asla kabullenmez kadına şiddet ve çocuk istismarları çocuk yaşta evliliğe evet deyip yasa geçiren zebanilerin boş hevesleridir kaldırmak bizler çok daha güçlü
824,Şanlıurfa'da hemşehrilerimizle bir araya gelerek hasret giderdik. Bizleri bağrına basan tüm hemşehrilerime yürekten teşekkür ederim.,Elif,2022-08-04 17:56:59.301011,Nötr,şanlıurfa da hemşehrilerimizle bir araya gelerek hasret giderdik bizleri bağrına basan tüm hemşehrilerime yürekten teşekkür ederim 
825,Ben seni böyle tanımazdım dedi senin yüzünden böyle oldum diyemedim,Elif,2022-08-04 17:56:59.290870,Nötr,ben seni böyle tanımazdım dedi senin yüzünden böyle oldum diyemedim
826,Vatana ihanet sadece silahla olmaz.,Meral,2022-08-04 17:56:59.301011,Nötr,vatana ihanet sadece silahla olmaz 
827,Kahkahalar yarim kaldi karanlikta,seymasa,2022-08-04 12:06:22.971227,Nötr,kahkahalar yarim kaldi karanlikta
828,"1000 TAKİPÇİNİN ALTINDA FUTBOL TAYFA KALMASIN !!  Birlik,beraberlik ve zevkli bir taym için bütün futbol tayfayı takipleşmeye davet ediyorum. Yoruma gt yaz ve yazanları takip et. Rtleyerek daha çok kişinin görmesini sağlayalım Gt yapmayacaklar katılmasın",Meral,2022-08-04 17:56:59.292614,Nötr, taki pçi ni n altinda futbol tayfa kalmasin birlik beraberlik ve zevkli bir taym için bütün futbol tayfayı takipleşmeye davet ediyorum yoruma gt yaz ve yazanları takip et rtleyerek daha çok kişinin görmesini sağlayalım gt yapmayacaklar katılmasın
829,bize gündemde olmak yakışır  #GökberkDemirci,Seymasa,2022-08-04 12:06:04.894124,Nötr,bize gündemde olmak yakışır
830,"""Bahar gösterisinde benim dans eşim ol."" ""Ben dans etmem."" ""Benim için et."" ""Senin neyin özel?"" ""Sen benim için özel birisin."" #matemçiçekleri",Elif,2022-08-04 17:56:59.301011,Nötr, bahar gösterisinde benim dans eşim ol ben dans etmem benim için et senin neyin özel sen benim için özel birisin 
831,Bence milletvekilliği yaşı 13 e düşürülebilir,seymasa,2022-08-04 12:06:04.894124,Nötr,bence milletvekilliği yaşı  e düşürülebilir
832,Quaresma futbolu bırakmış.. Ronaldo'nun benden daha yetenekli dediği tek adam Quaresma..,seymasa,2022-08-04 12:07:29.137951,Nötr,quaresma futbolu bırakmış ronaldo nun benden daha yetenekli dediği tek adam quaresma 
833,"Saygı değer cumhur başkan'ım , Rabbim Nice nice Beraber Bayramlaşmayı Nasip etsin, Sağlık huzur mutluluk içinde güzel bir bayram tatili diyorum. Hayırlı Bayramlar. #KurbanBayramı2022 3.Gün",Meral,2022-08-04 17:56:59.293547,Nötr,saygı değer cumhur başkan ım rabbim nice nice beraber bayramlaşmayı nasip etsin sağlık huzur mutluluk içinde güzel bir bayram tatili diyorum hayırlı bayramlar  gün
834,300. Yarış öncesi Sir Lewis Hamilton’ın kariyerine bir göz atalım.   En çok yarış zaferi (103)  Çaylak senesinde en çok yarış kazanan pilot (4)  Bir pistte en çok yarış kazanan isim (Britanya ve Macaristan-8)  Bir pistte art arda en çok kazanan pilot (İspanya-5-2017/2021),Meral,2022-08-04 17:56:59.301011,Nötr, yarış öncesi sir lewis hamilton ın kariyerine bir göz atalım en çok yarış zaferi  çaylak senesinde en çok yarış kazanan pilot  bir pistte en çok yarış kazanan isim britanya ve macaristan  bir pistte art arda en çok kazanan pilot i spanya    
835,Ben böyleyim.. Kendime saygı duyuyorum ve onuruma değer veriyorum. Kendimi kimseye empoze etmeyi sevmiyorum. Artık bana yer olmadığını hissettiğimde sessizce geri çekiliyorum. #SılaTürkoğlu  @silaturkogluu   @turkogluetkinlk,seymasa,2022-08-04 12:06:04.894124,Nötr,ben böyleyim kendime saygı duyuyorum ve onuruma değer veriyorum kendimi kimseye empoze etmeyi sevmiyorum artık bana yer olmadığını hissettiğimde sessizce geri çekiliyorum 
836,"Haydi Aslanlar! Kenetlenip, Sevinç Nur'a  'Umut' Olma  Zamanı!   Gün Birlik Günüdür! Yapacağınız Bağışlar Sevinç Nur'a Hayat Olsun... Sarı #GalatasaraySK Kırmızı @GalatasaraySK  @ultrAslan  @Galatasaray  @GsGazete  @sco1905  @PesindeyizApp  @SevgiAsk1905  @ultrAslanUNI  @CimbomFacts",Meral,2022-08-04 17:56:59.290870,Nötr,haydi aslanlar kenetlenip sevinç nur a umut olma zamanı gün birlik günüdür yapacağınız bağışlar sevinç nur a hayat olsun sarı kırmızı
837,Bizim işimiz Tribün futbolu konuşmak başkalarının işi biz aslında asıl görevimizi unuttuk bir silkelenip kendimize gelmeliyiz.,Meral,2022-08-04 17:56:59.293547,Nötr,bizim işimiz tribün futbolu konuşmak başkalarının işi biz aslında asıl görevimizi unuttuk bir silkelenip kendimize gelmeliyiz 
838,"İnsanlar bir hoş olmuş, Ben 90ları özlüyorum...  M.M.ÇEVİK",seymasa,2022-08-04 12:07:29.137951,Nötr,i nsanlar bir hoş olmuş ben ları özlüyorum m m çevi k
839,Türk her Zaman beklenen dir bunu o beyinsiz kafanıza sokun.  Dünkü görüşmeden sonra olası Süriye operasyonuna karşılık hemen devreye provakasyonlar girmeye başladı. BA.ŞA. RA. MA. YA. CAK. SI. NIZ.  #PkkMassacreInZaho,Meral,2022-08-04 17:56:59.301011,Nötr,türk her zaman beklenen dir bunu o beyinsiz kafanıza sokun dünkü görüşmeden sonra olası süriye operasyonuna karşılık hemen devreye provakasyonlar girmeye başladı ba şa ra ma ya cak si niz 
840,Yemin ederjm midem bulandı. İki oynayan iki yüzlü insanlardan nefret ediyorum..,Meral,2022-08-04 17:56:59.293547,Nötr,yemin ederjm midem bulandı i ki oynayan iki yüzlü insanlardan nefret ediyorum 
841,"Rabbinin yoluna hikmetle ve güzel öğütle davet et; onlarla en güzel yöntemle tartış. Kuşkusuz senin Rabbin, yolundan sapanların kim olduğunu en iyi bilendir; O, doğru yolda bulunanları da çok iyi bilir.  Nahl 125",Meral,2022-08-04 17:56:59.293547,Nötr,rabbinin yoluna hikmetle ve güzel öğütle davet et onlarla en güzel yöntemle tartış kuşkusuz senin rabbin yolundan sapanların kim olduğunu en iyi bilendir o doğru yolda bulunanları da çok iyi bilir nahl 
842,Kendilerine kalsa yapamayacakları için bir de utanmadan bizim sayemizde edebiyatı yaparak prim kasmaya çalışıyorlar...  Cumhuriyet tarihinin en niteliksiz muhalefeti ile karşı karşıyayız.,Meral,2022-08-04 17:56:59.292614,Nötr,kendilerine kalsa yapamayacakları için bir de utanmadan bizim sayemizde edebiyatı yaparak prim kasmaya çalışıyorlar cumhuriyet tarihinin en niteliksiz muhalefeti ile karşı karşıyayız 
843,"#Bağdat'da tepkilerin boyutu çok genişledi.  Yapılan hain saldırı Kinanarak Restorant girişlerine  ""Türklerin Girmesi Yasak"" uyarıları yazılıyor.",Meral,2022-08-04 17:56:59.293547,Nötr,tepkilerin boyutu çok genişledi yapılan hain saldırı kinanarak restorant girişlerine türklerin girmesi yasak uyarıları yazılıyor 
844,"Sen göğe bak.  Ben sana.  İkisi de aynı şey sonuçta.  Gök güzelse, senin yüzünden...",Meral,2022-08-04 17:56:59.290870,Nötr,sen göğe bak ben sana i kisi de aynı şey sonuçta gök güzelse senin yüzünden 
845,Biz zaten islam dinini yücelterek efendisi konumuna geldik. Anglo'nun dinine inananlar o dinin ancak kölesi olur. twitter.com/0datdat/status…,Meral,2022-08-04 17:56:59.301011,Nötr,biz zaten islam dinini yücelterek efendisi konumuna geldik anglo nun dinine inananlar o dinin ancak kölesi olur twitter com datdat status 
846,"Bizim kuşak üniversitede okurken, anne ve babayla okulda gözükmek düşünülemezdi. Z kuşağı ile birlikte, ilk önce veliler kayıt günlerinde gözüktü, sonra okul tanıtımlarında. En son da lise gibi hocalarla konuşmaya gelmeye başladılar. Sözde, çocukları 18 yaşında bağımsız bireyler.",Meral,2022-08-04 17:56:59.292614,Nötr,bizim kuşak üniversitede okurken anne ve babayla okulda gözükmek düşünülemezdi z kuşağı ile birlikte ilk önce veliler kayıt günlerinde gözüktü sonra okul tanıtımlarında en son da lise gibi hocalarla konuşmaya gelmeye başladılar sözde çocukları  yaşında bağımsız bireyler 
847,Geçenlerde çok güzel bir söz okudum çok anlamlı ve mantıklı bir söz.   “Sana iyi gelmeyen insanlarla tüm bağını koparmaya çalış; rahat edersin. Hayat konforun artar.”,Meral,2022-08-04 17:56:59.292614,Nötr,geçenlerde çok güzel bir söz okudum çok anlamlı ve mantıklı bir söz sana iyi gelmeyen insanlarla tüm bağını koparmaya çalış rahat edersin hayat konforun artar 
848,Tüm Basın Emekçilerimizin 24 Temmuz Gazeteciler ve #BasınBayramı'nı canı gönülden tebrik ederim.,Meral,2022-08-04 17:56:59.293547,Nötr,tüm basın emekçilerimizin  temmuz gazeteciler ve canı gönülden tebrik ederim 
849,"#TUKAS Niğde’de tahsis edilen 186.998 m2 arsada 528.7 milyon yatırım teşviğiyle kurulan salça,sebze konservesi,dondurulmuş gıda tesisinde 3000 ton/gün domates işleme kapasiteli salça işletmesi seri üretime hazır.   150 kişi istihdam edilecek 15 Temmuz itibariyle başladı",Meral,2022-08-04 17:56:59.293547,Nötr,niğde de tahsis edilen   m arsada   milyon yatırım teşviğiyle kurulan salça sebze konservesi dondurulmuş gıda tesisinde  ton gün domates işleme kapasiteli salça işletmesi seri üretime hazır  kişi istihdam edilecek  temmuz itibariyle başladı
850,Fluminenseliler Nino’nun gidişine üzülmekte çokta haksız değiller. Jesus baba fakir Lucio’su getiriyor Fenerine,Meral,2022-08-04 17:56:59.301011,Nötr,fluminenseliler nino nun gidişine üzülmekte çokta haksız değiller jesus baba fakir lucio su getiriyor fenerine
851,"Hak için vatanımın çıkarları doğrultusunda doğruya doğru,yanlışa yanlış demeyi ilke edinmiş biri olarak sözümün menzilini anlayan yazar  @mehmet_fiskeci   beyefendi beni mahçup etti. Güzel sözleri için teşekkür ederim. Acizane sizlerle de paylaşayım istedim.",Meral,2022-08-04 17:56:59.293547,Nötr,hak için vatanımın çıkarları doğrultusunda doğruya doğru yanlışa yanlış demeyi ilke edinmiş biri olarak sözümün menzilini anlayan yazar beyefendi beni mahçup etti güzel sözleri için teşekkür ederim acizane sizlerle de paylaşayım istedim 
852,"İstanbul’dan tatil için gittiği Sakarya’da, yolda yürürken sözlü tacize uğrayan genç kadın, sığındığı tekel bayisinde öldüresiye dövüldü",Meral,2022-08-04 17:56:59.293547,Nötr,i stanbul dan tatil için gittiği sakarya da yolda yürürken sözlü tacize uğrayan genç kadın sığındığı tekel bayisinde öldüresiye dövüldü
853,"#KadroBizimTediyeBizim 696khklı bitli 2018 yılında kadroya aldık dediler, ama belediye şirketine aktardılar yetmedi 3yıl sabit haklar ve %4+4 zam verdiler, sonra sendika geldi sevindik ama onlarda yılda bir %4 zam verdiler. Suçuda belediye başkanına attılar.Sonuç asgari ücret",Meral,2022-08-04 17:56:59.292614,Nötr,khklı bitli  yılında kadroya aldık dediler ama belediye şirketine aktardılar yetmedi yıl sabit haklar ve   zam verdiler sonra sendika geldi sevindik ama onlarda yılda bir  zam verdiler suçuda belediye başkanına attılar sonuç asgari ücret
854,Bu milletin utanmaz #FETÖ darbecileriyle  hesabı bitmedi.  DARBEYE DARBE YAPTIK #15Temmuz,Meral,2022-08-04 17:56:59.293547,Nötr,bu milletin utanmaz darbecileriyle hesabı bitmedi darbeye darbe yaptik
855,Herşeyi abartıp suyunu çıkarmakta üstümüze yok. O kadar süper duyarlı olduk ki öğrencimin bana söylediği; -Hocam kadına parfüm satın almak ona hakarettir. -Neden? -Ona pis kokuyorsun demektir. Alt metin okumada nirvana....,Meral,2022-08-04 17:56:59.290870,Nötr,herşeyi abartıp suyunu çıkarmakta üstümüze yok o kadar süper duyarlı olduk ki öğrencimin bana söylediği hocam kadına parfüm satın almak ona hakarettir neden ona pis kokuyorsun demektir alt metin okumada nirvana 
856,"Bu neşenin sonudur elbet , Derin bir baş ağrısı . Kahkahalar bugün senin , Peki ya bundan sonrası ?",Meral,2022-08-04 17:56:59.290870,Nötr,bu neşenin sonudur elbet derin bir baş ağrısı kahkahalar bugün senin peki ya bundan sonrası 
857,Hocam bu cümleleri normal bir insan kuramaz minnacık beyni olan bile kurmaya kalktığı anada yok ya ben bu kadar da saçmalamayayım der kurmaktan vazgeçer bunlarda beyin  göçü gerçekleşmiş sanırım sadece oksijen israfı,Meral,2022-08-04 17:56:59.293547,Nötr,hocam bu cümleleri normal bir insan kuramaz minnacık beyni olan bile kurmaya kalktığı anada yok ya ben bu kadar da saçmalamayayım der kurmaktan vazgeçer bunlarda beyin göçü gerçekleşmiş sanırım sadece oksijen israfı
858,akıl vermeyin rica ediyorum herkes akıl veriyor. akıl verme. işini yap geç. tık tık,Meral,2022-08-04 17:56:59.293547,Nötr,akıl vermeyin rica ediyorum herkes akıl veriyor akıl verme işini yap geç tık tık
859,"Genel Başkan Yardımcımız, Sosyal Politikalar Başkanımız Sn. Enes Kaşkaş ile birlikte Genç Esnaf ziyaretleri kapsamında Yönetim Kurulu üyesi arkadaşlarımızı iş yerlerinde ziyaret ettik.",Meral,2022-08-04 17:56:59.292614,Nötr,genel başkan yardımcımız sosyal politikalar başkanımız sn enes kaşkaş ile birlikte genç esnaf ziyaretleri kapsamında yönetim kurulu üyesi arkadaşlarımızı iş yerlerinde ziyaret ettik 
860,Şu bebeksi güzellik  #TubaBüyüküstün,Meral,2022-08-04 17:56:59.292614,Nötr,şu bebeksi güzellik
861,Ben ne kadar iyi niyetli temiz kalpli hiç kötülük düşünmeyen biriyim ya,Meral,2022-08-04 17:56:59.301011,Nötr,ben ne kadar iyi niyetli temiz kalpli hiç kötülük düşünmeyen biriyim ya
862,Huzurlu akşamlar olsun efendim,Meral,2022-08-04 17:56:59.290870,Nötr,huzurlu akşamlar olsun efendim
863,Çok yoruldum Allahım ne olur bana sevindirici haber gönder,Meral,2022-08-04 17:56:59.301011,Nötr,çok yoruldum allahım ne olur bana sevindirici haber gönder
864,danilo şefim hayat enerjisinin yüzde birini verse dünyanın en mutlu insani olurum,Meral,2022-08-04 17:56:59.301011,Nötr,danilo şefim hayat enerjisinin yüzde birini verse dünyanın en mutlu insani olurum
865,"Güneş Aslan burcuna geçti o zaman İyi ki Doğdunuz #AslanBurcu olanlar  Siz olmasaydınız güçlü, iradeli, egoyu kullanmayı bilen insanlar olmazdı. Her duruma karşı mücadele eden ve daima çalışkan insanlar Doğum gününüz kutlu olsun şimdi parlama zamanı",Meral,2022-08-04 17:56:59.301011,Nötr,güneş aslan burcuna geçti o zaman i yi ki doğdunuz olanlar siz olmasaydınız güçlü iradeli egoyu kullanmayı bilen insanlar olmazdı her duruma karşı mücadele eden ve daima çalışkan insanlar doğum gününüz kutlu olsun şimdi parlama zamanı
866,"Adıyaman Eğitim ve Araştırma Hastanesi’nde yatmakta olan hastalarımızı ve hasta yakınlarını ziyaret ederek geçmiş olsun dileklerimizi ilettik. Rabbim tüm hastalarımıza sağlık, sıhhat, afiyet versin. Şifa bekleyen tüm hastalara acil şifalar temenni ediyorum.",Meral,2022-08-04 17:56:59.301011,Nötr,adıyaman eğitim ve araştırma hastanesi nde yatmakta olan hastalarımızı ve hasta yakınlarını ziyaret ederek geçmiş olsun dileklerimizi ilettik rabbim tüm hastalarımıza sağlık sıhhat afiyet versin şifa bekleyen tüm hastalara acil şifalar temenni ediyorum 
867,İlk defa yazın geldiğini hissettim. O güzelim serin hava gitmiş yerine çöpp gibii leşş gibii yapış yapış sıcak hava gelmiş. Tiksiniyorum yaz aylarından goddamn,Meral,2022-08-04 17:56:59.301011,Nötr,i lk defa yazın geldiğini hissettim o güzelim serin hava gitmiş yerine çöpp gibii leşş gibii yapış yapış sıcak hava gelmiş tiksiniyorum yaz aylarından goddamn
868,"Allah'ın adaletine güvenip susan da var, Haksızlık karşısında susamayanda...  Susmuyoruz..!  #EmeklilikteYaşaTakılanlar",Meral,2022-08-04 17:56:59.293547,Nötr,allah ın adaletine güvenip susan da var haksızlık karşısında susamayanda susmuyoruz 
869,"Dolar bazlı temettü mü? Var mı öyle bişey?  4 gündür uğraştığım Eurobond çalışması sizlerle! RT yaparak destek olursanız çok sevinirim  @AhmetBeyefendi  hocam videosu ile bitirmeme çok yardımcı oldu.Ahmet hocam umarım hatasız olmuştur, değerli fikirlerinizi de almak isterim.",Meral,2022-08-04 17:56:59.301011,Nötr,dolar bazlı temettü mü var mı öyle bişey  gündür uğraştığım eurobond çalışması sizlerle rt yaparak destek olursanız çok sevinirim hocam videosu ile bitirmeme çok yardımcı oldu ahmet hocam umarım hatasız olmuştur değerli fikirlerinizi de almak isterim 
870,"Hey Betwon'lu   Betwon'a Arkadaşını DAVET ET, İlk Yatırımında %50 Bonus Kazan!   BetWon ile Hep Won!  http://bit.ly/Betwongiris",Meral,2022-08-04 17:56:59.293547,Nötr,hey betwon lu betwon a arkadaşını davet et i lk yatırımında  bonus kazan betwon ile hep won 
871,"Kalbini mi kırdım, Afedersin",Meral,2022-08-04 17:56:59.292614,Nötr,kalbini mi kırdım afedersin
