scraped_id,text,tagger,tagged_date,label,clean_data
442,Doğum gününe katılanlar takımdaki güney amerikalılar ve türkiyede yaşayan uruguaylı arkadaşlarıydı amına kodumun şişko obez piçi bunu gizlersen de amına koyim,Meral,2022-08-04 12:06:04.894124,Kızdırma,doğum gününe katılanlar takımdaki güney amerikalılar ve türkiyede yaşayan uruguaylı arkadaşlarıydı amına kodumun şişko obez piçi bunu gizlersen de amına koyim
443,"Babaları ABD tarafından öldürülen koca bir nesil yetim büyüdü. Sayısız tecavüz, katliam yaşandı. Amerikan Ordusu göz göre göre Irak merkez bankasının altınlarını yüklenip götürdü, böyle kinlenmediler. Din kardeşlerinize sokayım muhteremler.",Meral,2022-08-04 12:07:29.137951,Kızdırma,babaları abd tarafından öldürülen koca bir nesil yetim büyüdü sayısız tecavüz katliam yaşandı amerikan ordusu göz göre göre irak merkez bankasının altınlarını yüklenip götürdü böyle kinlenmediler din kardeşlerinize sokayım muhteremler 
444,"Düşündüğümden de alçak bir insanmış bu Bengi, tam bir lağım çukuru.",Meral,2022-08-04 12:06:01.868804,Kızdırma,düşündüğümden de alçak bir insanmış bu bengi tam bir lağım çukuru 
445,Karaktersiz Twitter milleti bu mecraya çektiğimiz için teşekkür edeceğine hesabımızı kapatıyor. Haksızmıyım  @sehersultan35  ?,Meral,2022-08-04 12:06:04.894124,Kızdırma,karaktersiz twitter milleti bu mecraya çektiğimiz için teşekkür edeceğine hesabımızı kapatıyor haksızmıyım 
446,"Ülkedeki ekonomik yıkım, patlayan işsizlik ve hayat pahalılığı karşısında muhtemelen üç maymunu oynayan insanlar bir dizi için STAR kanalının önünde toplanmış. Vaktinde kadına şiddet sahnelerinde de tepki gösterseydiniz keşke çok duyarlısınız ya. Allah aşkına bi yürüyün gidin ya.",Meral,2022-08-04 12:06:01.868804,Kızdırma,ülkedeki ekonomik yıkım patlayan işsizlik ve hayat pahalılığı karşısında muhtemelen üç maymunu oynayan insanlar bir dizi için star kanalının önünde toplanmış vaktinde kadına şiddet sahnelerinde de tepki gösterseydiniz keşke çok duyarlısınız ya allah aşkına bi yürüyün gidin ya 
447,Elinden tutup cehenneme gidecek kadar çok seviyordum seni ama bir adım atacak kadar bile  güvenmiyordum.,Meral,2022-08-04 12:07:29.137951,Kızdırma,elinden tutup cehenneme gidecek kadar çok seviyordum seni ama bir adım atacak kadar bile güvenmiyordum 
448,"At şikecisi olduğunuz için, at hırsızı olduğunuz için at iması yapıyorum. Anladın mı at kafası ?",Meral,2022-08-04 12:06:22.971227,Kızdırma,at şikecisi olduğunuz için at hırsızı olduğunuz için at iması yapıyorum anladın mı at kafası 
449,Güvensiz kalplerimizi karaktersiz insanlara borçluyuz.,Meral,2022-08-04 12:06:04.894124,Kızdırma,güvensiz kalplerimizi karaktersiz insanlara borçluyuz 
450,Bana bak lan dörtgöz,Meral,2022-08-04 12:06:01.868804,Kızdırma,bana bak lan dörtgöz
451,"Tam da adamına soruyo ! Bu kadının içişleri Bakanı olduğu dönem Türkiye iflas etmişti ! Alım gücüymüş, tek dertleri alım gücü ! Babana söyle ufaklık ! Yurt dışında sizin gibi nazlı Bebelere ihtiyacımız yok !  Sor bakim Babanın zamanında neleri varmış",Meral,2022-08-04 12:07:29.137951,Kızdırma,tam da adamına soruyo bu kadının içişleri bakanı olduğu dönem türkiye iflas etmişti alım gücüymüş tek dertleri alım gücü babana söyle ufaklık yurt dışında sizin gibi nazlı bebelere ihtiyacımız yok sor bakim babanın zamanında neleri varmış
452,bu ne ya iğrençsin,Meral,2022-08-04 12:06:22.971227,Kızdırma,bu ne ya iğrençsin
453,Her şeysiz her şey olabiliyor evet mesela beyinsiz kafatası da oluyor...,Meral,2022-08-04 12:06:22.971227,Kızdırma,her şeysiz her şey olabiliyor evet mesela beyinsiz kafatası da oluyor 
454,Hatalarim bana ders almam gerektiğini öğretti.  Ama yuh sen hata da değilmişsin ki hatalarım bile senden kıymetli,Meral,2022-08-04 12:06:04.894124,Kızdırma,hatalarim bana ders almam gerektiğini öğretti ama yuh sen hata da değilmişsin ki hatalarım bile senden kıymetli
455,Allahım sen beyinsiz insanları uzak tut bizden yaa,Meral,2022-08-04 12:06:22.971227,Kızdırma,allahım sen beyinsiz insanları uzak tut bizden yaa
456,Birileri şu IT firmalarına Agile adı altında sacma sapan rituelleri yapmanın ve ofiste şişko obez yöneticilerin pizza yemelerinin 'cool' olmadığını anlatsın,Meral,2022-08-04 12:06:01.868804,Kızdırma,birileri şu it firmalarına agile adı altında sacma sapan rituelleri yapmanın ve ofiste şişko obez yöneticilerin pizza yemelerinin cool olmadığını anlatsın
457,Yalancısın Rezilsin seni bir daha TV görmek istemiyoruz,Meral,2022-08-04 12:06:22.971227,Kızdırma,yalancısın rezilsin seni bir daha tv görmek istemiyoruz
458,Allah senin artık belanı versin midesiz iğrenç herif.. Oh be rahatladım be iğrençsin iğrenç,seymasa,2022-08-04 12:06:04.894124,Kızdırma,allah senin artık belanı versin midesiz iğrenç herif oh be rahatladım be iğrençsin iğrenç
459,"Şımarık yalı çocuğunun GAYRİMEŞRU YILDIZLI LOGO ricasına ilk yanıt, kirli ortalıklarını defalarca belirttiğimiz Ciner'in Habertürk'ünden geldi.    #HabertürkBoykot",seymasa,2022-08-04 12:06:22.971227,Kızdırma,şımarık yalı çocuğunun gayri meşru yildizli logo ricasına ilk yanıt kirli ortalıklarını defalarca belirttiğimiz ciner in habertürk ünden geldi 
460,tyt'de 1. olan kizin giydigi elbiseden makyajindan tutun okul mudurunun karsisinda oturusuna kadar herrr seyine hakaret etmisler. kiz hem dincileri kudurtup hem sinavi parcalamis kralice onunde egilirim amk.,Elif,2022-08-04 16:55:23.678371,Kızdırma,tyt de  olan kizin giydigi elbiseden makyajindan tutun okul mudurunun karsisinda oturusuna kadar herrr seyine hakaret etmisler kiz hem dincileri kudurtup hem sinavi parcalamis kralice onunde egilirim amk 
461,Şişko obez ve trabzon ekmegi diyebilirim ama,seymasa,2022-08-04 12:06:22.971227,Kızdırma,şişko obez ve trabzon ekmegi diyebilirim ama
462,amk keli int dogru duzgun cekmedigi icib baska yere gidip indirdigim bolumleri cevrimdisina ekliyorum fasfakirlik asiri zor,seymasa,2022-08-04 12:06:04.894124,Kızdırma,amk keli int dogru duzgun cekmedigi icib baska yere gidip indirdigim bolumleri cevrimdisina ekliyorum fasfakirlik asiri zor
463,"tuccarini da sikeyim acelesini de, basimiza ne geldiyse acelemizden geldi aq",seymasa,2022-08-04 12:06:04.894124,Kızdırma,tuccarini da sikeyim acelesini de basimiza ne geldiyse acelemizden geldi aq
464,yarım akıllı insanlardan bilim ilim din öğreneck değilim sülaleniz toplansa bildiklerim % 20 si etmez başka kapıya,seymasa,2022-08-04 16:55:23.679932,Kızdırma,yarım akıllı insanlardan bilim ilim din öğreneck değilim sülaleniz toplansa bildiklerim  si etmez başka kapıya
465,Soytarı testiyi kırdı.  Eşşek oğlu eşek.,seymasa,2022-08-04 12:06:01.868804,Kızdırma,soytarı testiyi kırdı eşşek oğlu eşek 
466,Yeterince yerden bitme prof var ablam aman aman,seymasa,2022-08-04 12:06:22.971227,Kızdırma,yeterince yerden bitme prof var ablam aman aman
467,Hiç merak etmiyorum nasılsa yine şerefsizlik peşindesin,seymasa,2022-08-04 12:06:04.894124,Kızdırma,hiç merak etmiyorum nasılsa yine şerefsizlik peşindesin
468,Yalancinin dibine koyayimmi lan dazlak.yalan olurda bu kadar olmaz yaaaa,seymasa,2022-08-04 16:55:23.678371,Kızdırma,yalancinin dibine koyayimmi lan dazlak yalan olurda bu kadar olmaz yaaaa
469,hasiktir ben her zaman tektim,seymasa,2022-08-04 12:06:01.868804,Kızdırma,hasiktir ben her zaman tektim
470,Cemre karakteri bana çok sümsük geliyor sevemedim #Tozluyaka,seymasa,2022-08-04 12:06:22.971227,Kızdırma,cemre karakteri bana çok sümsük geliyor sevemedim
471,Cocuk kadikoy barlar sokağında saci bitli gibi dolasir sadece,seymasa,2022-08-04 12:06:22.971227,Kızdırma,cocuk kadikoy barlar sokağında saci bitli gibi dolasir sadece
472,AHSJWHSJQHSKQJSAL KUDURUK KARI,seymasa,2022-08-04 12:06:04.894124,Kızdırma,ahsjwhsjqhskqjsal kuduruk kari
473,size acımadıysa sizi sevemez aptal misiniz,seymasa,2022-08-04 12:07:29.137951,Kızdırma,size acımadıysa sizi sevemez aptal misiniz
474,sonsuza kadar sümsük selim’ciyim,seymasa,2022-08-04 12:06:01.868804,Kızdırma,sonsuza kadar sümsük selim ciyim
475,ne beleşçi adamsın la,seymasa,2022-08-04 12:06:22.971227,Kızdırma,ne beleşçi adamsın la
476,Sen ne diyorsun amk keli,seymasa,2022-08-04 12:06:04.894124,Kızdırma,sen ne diyorsun amk keli
477,"Yalancıyı  miyorlar ya.. daha Ankapark’a erişim hakkına yeni erişti. İşte paralı köpek olmak böyle bir şey. i melihin milyonlarca dolarlık israfını savunmak için havlar, karşılığında haram maaş alır. Hoşt, köpek seni.",Meral,2022-08-04 17:56:59.290870,Kızdırma,yalancıyı miyorlar ya daha ankapark a erişim hakkına yeni erişti i şte paralı köpek olmak böyle bir şey i melihin milyonlarca dolarlık israfını savunmak için havlar karşılığında haram maaş alır hoşt köpek seni 
478,ilgi çekecek başka bi alan daha buldu amk keli,seymasa,2022-08-04 12:07:29.137951,Kızdırma,ilgi çekecek başka bi alan daha buldu amk keli
479,"Noa çirkef ikiyüzlü olan sensin...Sezon başından beri rüzgar nereye oraya dönen de sensin,Nagihan'ı önce yalayıp sonra kuduruk gibi saldıran da sensin...Tüm gün pc başında insanlara saldıracağına git bi hava al dışarı çık obez olacan iyice dombili...",Meral,2022-08-04 17:56:59.293547,Kızdırma,noa çirkef ikiyüzlü olan sensin sezon başından beri rüzgar nereye oraya dönen de sensin nagihan ı önce yalayıp sonra kuduruk gibi saldıran da sensin tüm gün pc başında insanlara saldıracağına git bi hava al dışarı çık obez olacan iyice dombili 
480,Hazal çocuk seni taciz ediyo sen hala nasıl susup Berk yaptı demiyorsun ya ölen çocuğa iftira atmasına nasıl izin veriyorsun iğrençsin  #tozluyaka,Meral,2022-08-04 17:56:59.292614,Kızdırma,hazal çocuk seni taciz ediyo sen hala nasıl susup berk yaptı demiyorsun ya ölen çocuğa iftira atmasına nasıl izin veriyorsun iğrençsin
481,Sizin gibi aşırı küstahlar da kara cahil tabi.!!,Meral,2022-08-04 17:56:59.292614,Kızdırma,sizin gibi aşırı küstahlar da kara cahil tabi 
482,"“ATATÜRK” TİCARETİNDEN MİLYONLAR KAZANAN YILMAZ ÖZDİL; ""Rumlar öyle meze yapar ki kardeşim, helali hoş olsun, Kıbrıs'ı veresin gelir!"" DİYEN ADAMDIR.  SENİ VERELİM YILMAZ. RUMLAR TEPE TEPE KULLANSIN.  VERELİM Mİ TWEET ALEMİ… #SONDAKİKA",Meral,2022-08-04 17:56:59.292614,Kızdırma, atatürk ti careti nden mi lyonlar kazanan yilmaz özdi l rumlar öyle meze yapar ki kardeşim helali hoş olsun kıbrıs ı veresin gelir di yen adamdir seni vereli m yilmaz rumlar tepe tepe kullansin vereli m mi tweet alemi 
483,2 günlük insanlar hesap soruyor pardon da sen kimsin,Meral,2022-08-04 17:56:59.293547,Kızdırma, günlük insanlar hesap soruyor pardon da sen kimsin
484,Allah aşkına Mehmet Ceyhan a hala inanan varsa aşı diye reklamını yaptığı zehirli sıvıları sonuna kadar olsunlar. Bu arada şeytanın hizmetkârı hala aşı olmadı bilginiz olsun. Hiç ölmeyecekmiş gibi şeytana ve dünyaya tapanlar cehenneme müdavim olursunuz inşallah.,Meral,2022-08-04 17:56:59.292614,Kızdırma,allah aşkına mehmet ceyhan a hala inanan varsa aşı diye reklamını yaptığı zehirli sıvıları sonuna kadar olsunlar bu arada şeytanın hizmetkârı hala aşı olmadı bilginiz olsun hiç ölmeyecekmiş gibi şeytana ve dünyaya tapanlar cehenneme müdavim olursunuz inşallah 
485,Sürtük Hande Fırat Bir insanlara bakıyorum Birde şu hayvana,Meral,2022-08-04 17:56:59.290870,Kızdırma,sürtük hande fırat bir insanlara bakıyorum birde şu hayvana
486,Rezilsin ya gerçekten rezil bi insansın tiskiniyorum senden,Meral,2022-08-04 17:56:59.292614,Kızdırma,rezilsin ya gerçekten rezil bi insansın tiskiniyorum senden
487,Ne karaktersiz insanmışssın..,Meral,2022-08-04 17:56:59.293547,Kızdırma,ne karaktersiz insanmışssın 
488,yemin ederim bakın allah belamı versin bazılarınız çok salak ya gerçekten insan o kadar süzme salak olmaktan utanır ya öyle bir eziklik ki yani sizin yerinize utanmaktan ben sıkıldım siz rezil olmaktan sıkılmadınız biraz büyüyün biraz olgunluk ya,Meral,2022-08-04 17:56:59.292614,Kızdırma,yemin ederim bakın allah belamı versin bazılarınız çok salak ya gerçekten insan o kadar süzme salak olmaktan utanır ya öyle bir eziklik ki yani sizin yerinize utanmaktan ben sıkıldım siz rezil olmaktan sıkılmadınız biraz büyüyün biraz olgunluk ya
489,Niye sakat ya da kafadan sakat oyuncuları alıyoruz?,Merve,2022-08-04 19:52:03.452431,Kızdırma,niye sakat ya da kafadan sakat oyuncuları alıyoruz 
490,bana bak lan dörtgöz  benim canımı sıkma  kafanı gözünü patlatırım ha  kes lan sesini ite bak  çakal oğlu çakallar allahın ayıları  çek  kardeşim çek,Merve,2022-08-04 23:05:40.391283,Kızdırma,bana bak lan dörtgöz benim canımı sıkma kafanı gözünü patlatırım ha kes lan sesini ite bak çakal oğlu çakallar allahın ayıları çek kardeşim çek
491,ortamci degilsin onu kastettim malum cok var bu sitede  mesaj silmemen mesajlarini overthink ederek atan bi tip oldugun gercegini degistirmedi pek su an djfnscnsjfj hatta bir suru mesaji atmaktan vazgecip siliyon,Merve,2022-08-04 23:05:40.391576,Kızdırma,ortamci degilsin onu kastettim malum cok var bu sitede mesaj silmemen mesajlarini overthink ederek atan bi tip oldugun gercegini degistirmedi pek su an djfnscnsjfj hatta bir suru mesaji atmaktan vazgecip siliyon
492,#sasa da bugün seans sonu gerçeklesen düşüşün ne kadar sığ olduğunu göstermek istedim. Kademeler resmen bomboş. Bu silkeleyip dökme hareketi. Malını kaptırana geçmiş olsun. Ekran izlememenin faydaları,Merve,2022-08-04 23:05:40.391576,Kızdırma,da bugün seans sonu gerçeklesen düşüşün ne kadar sığ olduğunu göstermek istedim kademeler resmen bomboş bu silkeleyip dökme hareketi malını kaptırana geçmiş olsun ekran izlememenin faydaları
493,Alkolü seven insanlara alkolik muamelesi yapmaktan vazgeçin artık,Merve,2022-08-04 23:05:40.391283,Kızdırma,alkolü seven insanlara alkolik muamelesi yapmaktan vazgeçin artık
494,E bu oyuncu kafadan sakat o zaman kanka arsenal dortmund istiyorsa ona giderdi kanka sallamadan önce az mantıklı ol,Merve,2022-08-04 23:05:40.390620,Kızdırma,e bu oyuncu kafadan sakat o zaman kanka arsenal dortmund istiyorsa ona giderdi kanka sallamadan önce az mantıklı ol
495,At kafası çıkmamış iyi ki :),Merve,2022-08-04 23:05:40.391283,Kızdırma,at kafası çıkmamış iyi ki 
496,"Büyük yaz bahri anlamıyom... Sakat mısın oğlum sen, o zaman neden araştırılmasını istemiyorsunuz. Araştırın kim suçluysa çıksın ortaya. Bıktım lan sizden nasıl uyuyorsunuz gece başınızı yastığa koyunca aklım almıyor...",Merve,2022-08-04 23:05:40.390620,Kızdırma,büyük yaz bahri anlamıyom sakat mısın oğlum sen o zaman neden araştırılmasını istemiyorsunuz araştırın kim suçluysa çıksın ortaya bıktım lan sizden nasıl uyuyorsunuz gece başınızı yastığa koyunca aklım almıyor 
497,Kim bu köpek soyu ? Kim kimin neresine çakıyor bi karşı karşıya gelelim bakalım!!!,Merve,2022-08-04 23:05:40.391283,Kızdırma,kim bu köpek soyu kim kimin neresine çakıyor bi karşı karşıya gelelim bakalım 
498,40 dk da 2 sarı karttan kırmızı yiyen adam da gram akıl yoktur,Merve,2022-08-04 23:05:40.393619,Kızdırma, dk da  sarı karttan kırmızı yiyen adam da gram akıl yoktur
499,Egonu bu ülkenin ekmeğini yiyeceksin az insaflı oyna be kardeşim,Merve,2022-08-04 23:05:40.391283,Kızdırma,egonu bu ülkenin ekmeğini yiyeceksin az insaflı oyna be kardeşim
500,Hoşt köpek,Merve,2022-08-04 23:05:40.391576,Kızdırma,hoşt köpek
501,İnanmayı tercih edenleri kandırdığını zanneden aptal insanlar,Merve,2022-08-04 23:05:40.393619,Kızdırma,i nanmayı tercih edenleri kandırdığını zanneden aptal insanlar
502,Bunada cevap ver özürlü,Merve,2022-08-04 23:05:40.390620,Kızdırma,bunada cevap ver özürlü
503,İnşallah ölene kadar soğan ekmek yersin köpek soyu,seymasa,2022-08-05 06:26:14.927338,Kızdırma,i nşallah ölene kadar soğan ekmek yersin köpek soyu
504,"Aptal, yanyana bakabilirdik aptal",seymasa,2022-08-05 06:26:14.927204,Kızdırma,aptal yanyana bakabilirdik aptal
505,Allah akıl fikir versin ne diyim ki shipçinin de böyle illet olanı,Merve,2022-08-04 23:05:40.393619,Kızdırma,allah akıl fikir versin ne diyim ki shipçinin de böyle illet olanı
506,Cunku basta senin gibi kan emiciler var bok sinekleri var ahlaksiz lar var pislik surat yokki tukurelim,seymasa,2022-08-05 06:26:14.926984,Kızdırma,cunku basta senin gibi kan emiciler var bok sinekleri var ahlaksiz lar var pislik surat yokki tukurelim
507,pijamam bile senden kıymetli bilüyon demi cicim!,Merve,2022-08-04 23:05:40.393619,Kızdırma,pijamam bile senden kıymetli bilüyon demi cicim 
508,Böyle bisey var mı sen ne istiyosun kızdan sana ne amk,seymasa,2022-08-05 06:26:14.927204,Kızdırma,böyle bisey var mı sen ne istiyosun kızdan sana ne amk
509,İçinizdeki pislikten tiksiniyorum.,seymasa,2022-08-05 06:26:14.930303,Kızdırma,i çinizdeki pislikten tiksiniyorum 
510,Salhane niye bu kadar pis kokuyorsun amk ya,seymasa,2022-08-05 06:26:14.927338,Kızdırma,salhane niye bu kadar pis kokuyorsun amk ya
511,"Hoşt köpek,önüne bak o zaman",seymasa,2022-08-05 06:26:14.926984,Kızdırma,hoşt köpek önüne bak o zaman
512,hayatimda senin kadar utanmaz cok az kisi gordum,seymasa,2022-08-04 12:07:29.137951,Kızdırma,hayatimda senin kadar utanmaz cok az kisi gordum
513,Yakında kim olduğunu mu açıklayacan la dörtgöz,seymasa,2022-07-31 22:11:42.468350,Kızdırma,yakında kim olduğunu mu açıklayacan la dörtgöz
514,Yok kuzu Adem midesiz olmadığı için ona iğrençsin diyen arkasından konuşan kimseye eyvallah etmediği için yapmış ama siz bilmezsiniz favınız kendisine orospu diyenlerle can ciğer kuzu sarması olduğu için,seymasa,2022-07-31 22:11:42.468350,Kızdırma,yok kuzu adem midesiz olmadığı için ona iğrençsin diyen arkasından konuşan kimseye eyvallah etmediği için yapmış ama siz bilmezsiniz favınız kendisine orospu diyenlerle can ciğer kuzu sarması olduğu için
515,Pp de soldaki benim. Sağdaki çarpık bacaklı uyuz kuzenim.,seymasa,2022-07-31 22:11:42.468350,Kızdırma,pp de soldaki benim sağdaki çarpık bacaklı uyuz kuzenim 
516,Yuva yıkıcı bir sarı çiyan gibisin,seymasa,2022-07-31 22:11:42.468350,Kızdırma,yuva yıkıcı bir sarı çiyan gibisin
517,Şeyma ayağını denk al sarı çiyan dmdmdmd,seymasa,2022-07-31 22:11:42.468350,Kızdırma,şeyma ayağını denk al sarı çiyan dmdmdmd
518,"2 gram aklınızla, akıl veriyorsunuz hiç aklınız kalmayacak haberiniz olsun.",seymasa,2022-07-31 22:11:42.469207,Kızdırma, gram aklınızla akıl veriyorsunuz hiç aklınız kalmayacak haberiniz olsun 
519,Özür dilemek için yol mu yapıyor bu sarı çiyan,seymasa,2022-07-31 22:11:42.469207,Kızdırma,özür dilemek için yol mu yapıyor bu sarı çiyan
520,"Bunlar beyin yerine sünger, vicdan yerine lağım çukuru taşıyor.",seymasa,2022-07-31 22:11:42.469207,Kızdırma,bunlar beyin yerine sünger vicdan yerine lağım çukuru taşıyor 
521,hem görgüsüz hem de vizyonsuz,seymasa,2022-07-31 22:11:42.469207,Kızdırma,hem görgüsüz hem de vizyonsuz
522,"İfrancan'ı ""at kafası Bilal"" e benzeten bir tek ben miyim",seymasa,2022-07-31 22:11:42.469207,Kızdırma,i francan ı at kafası bilal e benzeten bir tek ben miyim
523,Mansur Yavaş gibi silik bir adamın neden bu kadar sevildiğini anlamıyorum. Mevcut adaylar arasında liderlik vasfı olmayan tek kişi.,seymasa,2022-07-31 22:11:42.469207,Kızdırma,mansur yavaş gibi silik bir adamın neden bu kadar sevildiğini anlamıyorum mevcut adaylar arasında liderlik vasfı olmayan tek kişi 
524,Sarı kızı gören var mı? Asdfghhklş sarı çıyan milleti birbirine düşürdü,seymasa,2022-07-31 22:11:42.469207,Kızdırma,sarı kızı gören var mı asdfghhklş sarı çıyan milleti birbirine düşürdü
525,"su dalyaraklari artık siralamadan biriyle dovustursunler. hem karıyı hem bunu, şunları deplasmanda coluk çocuğu dovdurup hype pesinde amk keli",seymasa,2022-07-31 22:11:42.469207,Kızdırma,su dalyaraklari artık siralamadan biriyle dovustursunler hem karıyı hem bunu şunları deplasmanda coluk çocuğu dovdurup hype pesinde amk keli
526,Sakat mısın daha iki gün önce hesabı açmışsın. Ya sen büyük hastasın. Yazık kafana.,seymasa,2022-07-31 22:11:42.469207,Kızdırma,sakat mısın daha iki gün önce hesabı açmışsın ya sen büyük hastasın yazık kafana 
527,Bu sarı çiyan canım Karımın getir götürünü bile yapamaz,seymasa,2022-07-31 22:11:42.469207,Kızdırma,bu sarı çiyan canım karımın getir götürünü bile yapamaz
528,PWMOSKAPSL ben aslında rahibeyim amk keli,seymasa,2022-07-31 22:11:42.469207,Kızdırma,pwmoskapsl ben aslında rahibeyim amk keli
529,Lağım çukuru,seymasa,2022-07-31 22:11:42.469207,Kızdırma,lağım çukuru
530,Awk karisi cüzdan mi bu ya bi bebeğe bile sahip cikamamis meymenetsiz kare kafa,seymasa,2022-07-31 22:11:42.471547,Kızdırma,awk karisi cüzdan mi bu ya bi bebeğe bile sahip cikamamis meymenetsiz kare kafa
531,Yahu sen hıyar mısın? Sadece Google’da iki dakika araştırsan yeter.,seymasa,2022-07-31 22:11:42.471547,Kızdırma,yahu sen hıyar mısın sadece google da iki dakika araştırsan yeter 
532,Sakat mısın?,seymasa,2022-07-31 22:11:42.471547,Kızdırma,sakat mısın 
533,Dünyanın en sevimsiz karısı,seymasa,2022-07-31 22:11:42.471547,Kızdırma,dünyanın en sevimsiz karısı
534,Kulaklığım bile senden daha kıymetli bu ne vazgeçilmez tavırların??,seymasa,2022-07-31 22:11:42.471547,Kızdırma,kulaklığım bile senden daha kıymetli bu ne vazgeçilmez tavırların 
535,"Mesih, bütün milletlerin Mesihidir! Boş yapma, işine bak",seymasa,2022-07-31 22:11:42.471547,Kızdırma,mesih bütün milletlerin mesihidir boş yapma işine bak
536,şerefsiz barış keremin sürprizine konmuştu sümsük,seymasa,2022-07-31 22:11:42.471547,Kızdırma,şerefsiz barış keremin sürprizine konmuştu sümsük
537,Bu bayram da kimseyle barışmıcam şerefsizlik yapmasaydınız,seymasa,2022-07-31 22:11:42.471959,Kızdırma,bu bayram da kimseyle barışmıcam şerefsizlik yapmasaydınız
538,Hasiktir ya,seymasa,2022-07-31 22:11:42.471959,Kızdırma,hasiktir ya
539,"Aciz, ithal zihniyetli muhalefet. Yaptıkları şey hep aynı, kıçları sıkışınca mağdura yatarlar. Beceriksiz niteliksiz insanlar",seymasa,2022-07-31 22:11:42.471959,Kızdırma,aciz ithal zihniyetli muhalefet yaptıkları şey hep aynı kıçları sıkışınca mağdura yatarlar beceriksiz niteliksiz insanlar
540,"Cücük gazeteciyi paranın miktarı tatmin etmemiş, süzme salak...",seymasa,2022-07-31 22:11:42.471959,Kızdırma,cücük gazeteciyi paranın miktarı tatmin etmemiş süzme salak 
541,Guzel haberler almayali uzun zaman olmustu mekani lagim cukuru olsun,seymasa,2022-07-31 22:11:42.471959,Kızdırma,guzel haberler almayali uzun zaman olmustu mekani lagim cukuru olsun
542,Ne oldu Sahra ya gomeceyin yeremi gomuldun pislik surat #SurvivorAllStar,seymasa,2022-08-01 06:47:53.726596,Kızdırma,ne oldu sahra ya gomeceyin yeremi gomuldun pislik surat
543,Bizene aq sizin kulüp toptan sakat ama kafadan,seymasa,2022-08-01 06:47:53.726596,Kızdırma,bizene aq sizin kulüp toptan sakat ama kafadan
544,Sen ne anlarsın sanattan Sanat: ademoglu kızgın firin havva kizi mercimek,seymasa,2022-08-01 06:47:53.726596,Kızdırma,sen ne anlarsın sanattan sanat ademoglu kızgın firin havva kizi mercimek
545,o kadar karaktersiz şerefsizlersiniz ki kendi yaptıklarınızı sırf kendinizi haklı çıkartmak için millete yalan yanlış anlatıp bok atıyorsunuz,seymasa,2022-08-01 06:47:53.726631,Kızdırma,o kadar karaktersiz şerefsizlersiniz ki kendi yaptıklarınızı sırf kendinizi haklı çıkartmak için millete yalan yanlış anlatıp bok atıyorsunuz
546,İroni olsun diye twit atarız. İllaki bir tane de olsa sıçtığı bokta bile zeka kalıntısı olduğunu sanan süzme salak çıkar gelir yorum yapar. Twitter'ın olayı da bu işte,seymasa,2022-08-01 06:47:53.726631,Kızdırma,i roni olsun diye twit atarız i llaki bir tane de olsa sıçtığı bokta bile zeka kalıntısı olduğunu sanan süzme salak çıkar gelir yorum yapar twitter ın olayı da bu işte
547,"Lan oğlum, lan dörtgöz, siz bizi delirtmeye and mı içtiniz yavrum? “İlgili tüm kurumlar” talimatsız harekete geçmiyor mu? Neden adları İLGİLİ KURUM öyleyse? Yahu nasıl bir imaj erimesi yaşıyorsunuz da afetten bile nemalanma peşine düştünüz? Bu nasıl bir sülüklük ulan?",seymasa,2022-08-01 06:47:53.726631,Kızdırma,lan oğlum lan dörtgöz siz bizi delirtmeye and mı içtiniz yavrum i lgili tüm kurumlar talimatsız harekete geçmiyor mu neden adları i lgi li kurum öyleyse yahu nasıl bir imaj erimesi yaşıyorsunuz da afetten bile nemalanma peşine düştünüz bu nasıl bir sülüklük ulan 
548,O kupa sana hiç yakışmadı hatta çok komik durdu o kupayı eline alıp gezmekle all star şampiyonu olmuyorsun elinde kupa değil oyuncak ayı olsa daha yakışırdı igrencsin 39luk niza TorpilinAdı NisaBölükbaşı,seymasa,2022-08-01 06:47:53.726631,Kızdırma,o kupa sana hiç yakışmadı hatta çok komik durdu o kupayı eline alıp gezmekle all star şampiyonu olmuyorsun elinde kupa değil oyuncak ayı olsa daha yakışırdı igrencsin luk niza torpilinadı nisabölükbaşı
